speaker,addressed,lineorder,combinedline,numberofrows,wordcount,mode,yarn_id
QUI-GON,JAR JAR,347,"Nevertheless, the boy is right. You were heading into trouble.",2,10,
QUI-GON,ANAKIN,348,"Thanks, my young friend.",1,4,
JAR JAR,QUI-GON,349,But mesa doen nutten!,1,4,
OBI-WAN,CAPT. PANAKA,350,This storm will slow them down.,1,6,
CAPT. PANAKA,OBI-WAN,351,Looks pretty bad. ,1,3,
CAPT. PANAKA,RIC OLIE,352,Panaka.,1,1,
RIC OLIE,CAPT. PANAKA,353,Receiving a message from home.,1,5,
CAPT. PANAKA,RIC OLIE,354,We'll be right there.,1,4,
ANAKIN,QUI-GON,355,"Here, you'll like these pallies. Here.",2,6,
QUI-GON,ANAKIN,356,Thank you.,1,2,
JIRA,ANAKIN,357,"Oh, my bones are aching. Storm's coming up, Ani. You better get home quick.",3,14,
ANAKIN,"QUI-GON, PADME",358,Do you have shelter?,1,4,
QUI-GON,ANAKIN,359,We'll head back to our ship.,1,6,
ANAKIN,"QUI-GON, PADME",360,Is it far?,1,3,
QUI-GON,ANAKIN,361,It's on the outskirts.,1,4,
ANAKIN,"QUI-GON, PADME, JAR JAR, R2D2",362,"You'll never reach the outskirts in time. Sandstorms are very, very dangerous. Come on. I'll take you to my place.",5,20,
ANAKIN,SHMI,363,"Mom! Mom, I'm home!",2,4,
JAR JAR,ANAKIN,364,"Ah, dissen cosy.",1,3,
ANAKIN,SHMI,365,"These are my friends, Mom.",1,5,
JAR JAR,SHMI,366,Hello.,1,1,
QUI-GON,SHMI,367,I'm Qui-Gon Jinn.,1,3,
ANAKIN,PADME,368,I'm building a droid. You wanna see?,1,7,
QUI-GON,SHMI,369,Your son was kind enough to offer us shelter.,2,9,
ANAKIN,PADME,370,Come on. I'll show you Threepio.,1,6,
ANAKIN,PADME,371,Isn't he great? He's not finished yet.,2,7,
PADME,ANAKIN,372,He's wonderful.,1,2,
ANAKIN,PADME,373,You really like him? He's a protocol droid to help Mom. Watch.,3,12,
THREEPIO,ANAKIN,374,Where is everybody?,1,3,
ANAKIN,ANAKIN,375,Whoops.,1,1,
THREEPIO,"ANAKIN, PADME",376,"Oh, hello. I am C-3PO, human cyborg relations. How might I serve you?",4,13,
PADME,ANAKIN,377,He's perfect.,1,2,
THREEPIO,PADME,378,Oh. Perfect.,1,2,
ANAKIN,PADME,379,"When the storm is over, I'll show you my racer. I'm building a Podracer.",2,14,
THREEPIO,"ANAKIN, PADME",380,I'm not sure this floor is entirely stable.,2,8,
THREEPIO,R2D2,381,Hello. I don't believe we have been introduced.,2,8,
THREEPIO,R2D2,382,R2D2. A pleasure to meet you.,2,6,
THREEPIO,R2D2,383,"I am C-3PO, human cyborg relations.",2,6,
THREEPIO,R2D2,384,"I beg your pardon, but what do you mean, ""naked""?",2,10,
THREEPIO,R2D2,385,My parts are showing? My goodness!,2,6,
PALPATINE,"SABE, OBI-WAN, QUI-GON",386,The death toll is catastrophic. We must bow to their wishes. You must contact me.,3,15,recording
OBI-WAN,SABE,387,It's a trick. Send no reply. Send no transmissions of any kind.,3,12,
QUI-GON,OBI-WAN,388,It sounds like bait to establish a connection trace.,2,9,
OBI-WAN,QUI-GON,389,"What if it is true, and the people are dying?",2,10,
QUI-GON,OBI-WAN,390,"Either way, we're running out of time.",2,7,
DARTH MAUL,PALPATINE,391,"Tatooine is sparsely populated. If the trace was correct, I will fnd them quickly, Master.",3,15,
PALPATINE,DARTH MAUL,392,Move against the Jedi first. You will then have no difficulty in taking the queen to Naboo... to sign the treaty.,4,21,
DARTH MAUL,PALPATINE,393,At last we will reveal ourselves to the Jedi. At last we will have revenge.,3,15,
PALPATINE,DARTH MAUL,394,"You have been well-trained, my young apprentice. They will be no match for you.",3,14,
SHMI,"QUI-GON, PADME",395,All slaves have a transmitter placed inside their bodies somewhere.,2,10,
ANAKIN,"QUI-GON, PADME",396,I've been working on a scanner to try and locate mine.,2,11,
SHMI,"QUI-GON, PADME, JAR JAR",397,Any attempt to escape...,1,4,
ANAKIN,"QUI-GON, PADME, JAR JAR",398,And they blow you up! Boom!,1,6,
JAR JAR,"ANAKIN, SHMI",399,How wude!,1,2,
PADME,"SHMI, ANAKIN",400,I can't believe there's still slavery in the galaxy. The Republic's antislavery laws...,3,13,
SHMI,PADME,401,The Republic doesn't exist out here. We must survive on our own.,2,12,
JAR JAR,"QUI-GON, PADME, ANAKIN, SHMI",402,Xcuse me.,1,2,
ANAKIN,"QUI-GON, PADME, JAR JAR",403,Has anybody ever seen a Podrace?,1,6,
QUI-GON,"ANAKIN, PADME, JAR JAR, SHMI",404,"They have Podracing on Malastare. Very fast, very dangerous.",3,9,
ANAKIN,"QUI-GON, PADME, JAR JAR",405,I'm the only human who can do it.,1,8,
QUI-GON,ANAKIN,406,You must have Jedi reflexes if you race pods.,2,9,
QUI-GON,JAR JAR,407,Don't do that again.,1,4,
ANAKIN,QUI-GON,408,"You're a Jedi knight, aren't you?",1,6,
QUI-GON,ANAKIN,409,What makes you think that?,1,5,
ANAKIN,QUI-GON,410,I saw your laser sword. Only Jedis carry that kind of weapon.,3,12,
QUI-GON,ANAKIN,411,Perhaps I killed a Jedi and took it from him.,2,10,
ANAKIN,QUI-GON,412,I don't think so. No one can kill a Jedi.,2,10,
QUI-GON,ANAKIN,413,I wish that were so.,1,5,
ANAKIN,"QUI-GON, PADME, SHMI",414,I had a dream I was a Jedi. I came back here and freed all the slaves.,3,17,
ANAKIN,QUI-GON,415,Have you come to free us?,1,6,
QUI-GON,ANAKIN,416,"No, I'm afraid not.",1,4,
ANAKIN,QUI-GON,417,I think you have. Why else would you be here?,2,10,
QUI-GON,ANAKIN,418,"I can see there's no fooling you, Anakin.",2,8,
QUI-GON,"ANAKIN, SHMI",419,"We're on our way to Coruscant, the central system in the Republic... on a very important mission.",3,17,
ANAKIN,"QUI-GON, PADME, JAR JAR",420,How did you end up out here in the outer rim?,2,11,
PADME,ANAKIN,421,"Our ship was damaged, and we're stranded here until we can repair it.",2,13,
ANAKIN,"QUI-GON, PADME, JAR JAR",422,I can help. I can fix anything.,2,7,
QUI-GON,ANAKIN,423,I believe you can. But first we must acquire the parts we need.,3,13,
JAR JAR,"ANAKIN, QUI-GON, PADME, SHMI",424,Wit no-nutten mula to trade.,1,5,
PADME,"ANAKIN, SHMI, QUI-GON, JAR JAR",425,These junk dealers must have a weakness of some kind.,2,10,
SHMI,"PADME, QUI-GON, JAR JAR",426,Gambling. Everything here revolves around betting on those awful races.,2,10,
QUI-GON,SHMI,427,Podracing. Greed can be a powerful ally.,2,7,
ANAKIN,"QUI-GON, PADME, JAR JAR",428,I built a racer. It's the fastest ever. There's a big race tomorrow on Boonta Eve.,4,16,
ANAKIN,QUI-GON,429,You could enter my pod.,1,5,
SHMI,ANAKIN,430,"Anakin, Watto won't let you.",1,5,
ANAKIN,SHMI,431,Watto doesn't know I've built it. You could make him think it was yours... and get him to let me pilot it for you.,5,24,
SHMI,ANAKIN,432,I don't want you to race. It's awful. I die every time Watto makes you do it.,4,17,
ANAKIN,SHMI,433,"But, Mom, I love it. The prize money would more than pay for the parts they need.",3,17,
SHMI,ANAKIN,434,Anakin.,1,1,
QUI-GON,ANAKIN,435,Your mother's right.,1,3,
QUI-GON,"ANAKIN, SHMI",436,Is there anyone friendly to the Republic who can help us?,2,11,
SHMI,QUI-GON,437,No.,1,1,
ANAKIN,SHMI,438,"Mom, you say the biggest problem in this universe is nobody helps each other.",2,14,
PADME,SHMI,439,I'm sure Qui-Gon doesn't want to put your son in danger. We'll find some other way.,3,16,
SHMI,"QUI-GON, PADME",440,"No. There is no other way. I may not like it, but he can help you. He was meant to help you.",4,22,
PADME,QUI-GON,441,Are you sure about this? Trusting our fate to a boy we hardly know? The queen will not approve.,4,19,
QUI-GON,PADME,442,The queen doesn't need to know.,1,6,
PADME,QUI-GON,443,"Well, I don't approve.",1,4,
WATTO,QUI-GON,444,"The boy tells me you want to sponsor him in the race. How can you do this? Not on the Republic credits, I think.",5,24,
QUI-GON,WATTO,445,My ship will be the entry fee.,1,7,
WATTO,QUI-GON,446,"Not bad! Not bad, huh? Nubian, huh?",3,7,
QUI-GON,WATTO,447,"It's in good order, except for the parts I need.",2,10,
WATTO,"QUI-GON, ANAKIN",448,What would the boy ride? He smashed up my pod in the last race. It would take some long time to fx it.,3,23,
ANAKIN,"WATTO, QUI-GON",449,"It wasn't my fault. Really. Sebulba flashed me with his vents. I actually saved the pod, mostly.",4,17,
WATTO,ANAKIN,450,That you did.,1,3,
WATTO,QUI-GON,451,"The boy's good. No doubts there, huh?",2,7,
QUI-GON,WATTO,452,I have acquired a pod in a game of chance. The fastest ever built.,3,14,
WATTO,QUI-GON,453,"I hope you didn't kill anyone I know for it, huh? So, you supply the pod and the entry fee... and I supply the boy. We split the winnings 50-50, I think, huh?",7,33,
QUI-GON,WATTO,454,"If it's going to be 50-50... I suggest you front the cash for the entry. If we win... you keep all the winnings, minus the cost of the parts I need. And if we lose, you keep my ship. Either way, you win.",9,43,
WATTO,QUI-GON,455,Deal!,1,1,
WATTO,ANAKIN,456,"Your friend is a foolish one, methinks.",2,7,
OBI-WAN,QUI-GON,457,"What if this plan fails, Master? We could be stuck here a very long time.",3,15,
QUI-GON,OBI-WAN,458,"Well, it's too dangerous to call for help... and a ship without a power supply isn't going to get us anywhere. And... there's something about this boy.",6,27,
QUI-GON,SHMI,459,You should be very proud of your son. He gives without any thought of reward.,3,15,
SHMI,QUI-GON,460,"Well, he knows nothing of greed. He has...",2,8,
QUI-GON,SHMI,461,He has special powers.,1,4,
SHMI,QUI-GON,462,Yes.,1,1,
QUI-GON,SHMI,463,He can see things before they happen. That's why he appears to have such quick reflexes. It's a Jedi trait.,5,20,
SHMI,QUI-GON,464,He deserves better than a slave's life.,2,7,
QUI-GON,SHMI,465,"Had he been born in the Republic, we would have identifed him early. The Force is unusually strong with him. That much is clear. Who was his father?",5,28,
SHMI,QUI-GON,466,"There was no father. I carried him, I gave birth, I raised him. I can't explain what happened. Can you help him?",5,22,
QUI-GON,SHMI,467,I don't know. I didn't actually come here to free slaves.,3,11,
KITSTER,ANAKIN,468,Hi Ani!,1,2,
ANAKIN,KITSTER,469,Hi!,1,1,
KITSTER,ANAKIN,470,"Wow, a real astro droid!",1,5,
KITSTER,ANAKIN,471,How do you get so lucky?,1,6,
ANAKIN,KITSTER,472,That isn't the half of it. I'm in the Boonta race tomorrow.,2,12,
KITSTER,ANAKIN,473,What? With this?,2,3,
GREEDO,ANAKIN,474,"You're such a joker, Ani.",1,5,
AMEE,ANAKIN,475,You've been working on that for years.,1,7,
MELEE,ANAKIN,476,It's never gonna run.,1,4,
SEEK,ANAKIN,477,"Come on. Let's go and play ball. Keep racing, Ani. You're gonna be bug squash.",4,15,
ANAKIN,JAR JAR,478,"Hey Jar Jar, keep away from those energy binders. If your hand gets caught in the beam, it's gonna go numb for hours.",4,23,
JAR JAR,ANAKIN,479,Sorry. Okay.,1,2,
JAR JAR,JAR JAR,480,"My tongue is fat. My tongue... Wrench. Where is de wrench? Oh, dare it is. I'm stuck.",5,17,
THREEPIO,R2D2,481,"You know, I fnd that Jar Jar creature to be a little odd.",2,13,
KITSTER,ANAKIN,482,You don't even know if this thing's gonna run.,2,9,
ANAKIN,KITSTER,483,It will.,1,2,
QUI-GON,"KITSTER, ANAKIN",484,I think it's time we found out.,1,7,
QUI-GON,ANAKIN,485,"Here, use this power charge.",1,5,
ANAKIN,QUI-GON,486,"Yes, sir!",1,2,
QUI-GON,KITSTER,487,"Come on, Kitster. Let's move away.",2,6,
JAR JAR,JAR JAR,488,My mouth.,1,2,
JAR JAR,ANAKIN,489,"Ani, I'm stuck.",1,3,
JAR JAR,"PADME, ANAKIN",490,Hey. My tongue is fat. Ani.,1,6,
THREEPIO,R2D2,491,You're quite right. He's very odd indeed.,2,7,
JAR JAR,PADME,492,Thank you.,1,2,
JAR JAR,ANAKIN,493,Go.,1,1,
ANAKIN,"PADME, QUI-GON, JAR JAR",494,It's working! It's working!,2,4,
QUI-GON,ANAKIN,495,"Stay still, Ani. Let me clean this cut.",2,8,
ANAKIN,QUI-GON,496,There's so many. Do they all have a system of planets?,2,11,
QUI-GON,ANAKIN,497,Most of them.,1,3,
ANAKIN,QUI-GON,498,Has anyone been to 'em all?,1,6,
QUI-GON,ANAKIN,499,Not likely.,1,2,
ANAKIN,QUI-GON,500,I wanna be the frst one to see 'em all.,2,10,
SHMI,ANAKIN,501,"Ani, bedtime!",1,2,
QUI-GON,ANAKIN,502,There we are. Good as new.,2,6,
SHMI,ANAKIN,503,"Ani, I'm not gonna tell you again.",1,7,
ANAKIN,QUI-GON,504,What are you doing?,1,4,
QUI-GON,ANAKIN,505,"Checking your blood for infections. Go on. You have a big day tomorrow. Sleep well, Ani.",4,16,
QUI-GON,OBI-WAN,506,Obi-Wan?,1,1,
OBI-WAN,QUI-GON,507,"Yes, Master?",1,2,
QUI-GON,OBI-WAN,508,I need an analysis of this blood sample I'm sending you.,2,11,
OBI-WAN,QUI-GON,509,Wait a minute.,1,3,
QUI-GON,OBI-WAN,510,I need a midi-chlorian count.,1,5,
OBI-WAN,QUI-GON,511,"The reading is off the chart. Over 20,000. Even Master Yoda doesn't have a midi-chlorian count that high.",4,18,
QUI-GON,OBI-WAN,512,No Jedi has.,1,3,
OBI-WAN,QUI-GON,513,What does that mean?,1,4,
QUI-GON,OBI-WAN,514,I'm not sure.,1,3,
WATTO,QUI-GON,515,I wanna see your spaceship the moment the race is over.,2,11,
QUI-GON,WATTO,516,"Patience, my blue friend. You'll have your winnings before the suns set. And we'll be far away from here.",4,19,
WATTO,QUI-GON,517,"Not if your ship belongs to me, I think, huh? I warn you, no funny business.",3,16,
QUI-GON,WATTO,518,You don't think Anakin can win?,1,6,
WATTO,QUI-GON,519,"Don't get me wrongo. I have great faith in the boy. He's a credit to your race... but Sebulba there is going to win, I think.",5,26,
JAR JAR,QUI-GON,520,"Oh, no!",1,2,
QUI-GON,WATTO,521,Why do you think that?,1,5,
WATTO,QUI-GON,522,He always wins! I am betting heavily on Sebulba.,2,9,
QUI-GON,WATTO,523,I'll take that bet.,1,4,
WATTO,QUI-GON,524,You What?,1,2,
QUI-GON,WATTO,525,"I'll wager my new racing pod against, say... the boy and his mother.",3,13,
WATTO,QUI-GON,526,"No pod is worth two slaves, not by a long shot.",2,11,
QUI-GON,WATTO,527,"The boy, then.",1,3,
WATTO,QUI-GON,528,"Well, we'll let fate decide, huh? I just happen to have a chance cube here. Blue, it's the boy. Red... his mother. You won this small toss, outlander... but you won't win the race! So it makes little difference!",10,39,
WATTO,ANAKIN,529,Better stop your friend's betting or I'll end up owning him too.,2,12,
ANAKIN,QUI-GON,530,What'd he mean by that?,1,5,
QUI-GON,ANAKIN,531,I'll tell you later.,1,4,
QUI-GON,SHMI,532,Good morning.,1,2,
THREEPIO,R2D2,533,"Oh, my.",1,2,
THREEPIO,R2D2,534,Space travel sounds rather perilous.,1,5,
THREEPIO,R2D2,535,"I can assure you, they will never get me onto one of those dreadful starships.",2,15,
KITSTER,ANAKIN,536,"This is so wizard, Ani. I'm sure you'll do it this time.",2,12,
PADME,"KITSTER, ANAKIN",537,Do what?,1,2,
KITSTER,PADME,538,"Finish the race, of course.",1,5,
PADME,ANAKIN,539,You've never won a race?,1,5,
ANAKIN,PADME,540,"Well, not exactly.",1,3,
PADME,ANAKIN,541,Not even finished?,1,3,
ANAKIN,PADME,542,Kitster's right. I will this time.,2,6,
QUI-GON,ANAKIN,543,Of course you will.,1,4,
BEED,NA,544,That's absolutely right. And a big turnout here from all corners of the outer rim territories. I see the contestants are making their way out onto the starting grid.,5,29,
FODE,NA,545,I see Ben Quadinaros from the Tund System.,2,8,
BEED,NA,546,Two-time winner Boles Roor.,1,4,
FODE,NA,547,Sebulba!,1,1,
BEED,NA,548,"And in the front row, nearside pole position... Mawhonic! A hearty hello... to Clegg Holdfast and his Voltec KT9 Wasp! And back again, it's the mighty Dud Bolt... with that incredible racing machine, the Vulptereen 327. And hoping for a big win today... Ody Mandrell, with his record-setting pit droid team. And a late entry, young Anakin Skywalker... a local boy. I see the flags are moving out onto the track.",18,71,
JAR JAR,NA,549,Pee yusa,1,2,
SHMI,ANAKIN,550,Be safe.,1,2,
ANAKIN,SHMI,551,"I will, Mom. I promise.",1,5,
SEBULBA,ANAKIN,552,Uh-oh. You won't walk away from this one... you slave scum.,2,11,
ANAKIN,SEBULBA,553,"Don't count on it, slime ball.",1,6,
SEBULBA,ANAKIN,554,You're bantha fodder!,1,3,
QUI-GON,ANAKIN,555,"You all set, Ani?",1,4,
ANAKIN,QUI-GON,556,Yep.,1,1,
QUI-GON,ANAKIN,557,"Right. Remember, concentrate on the moment. Feel, don't think. Use your instincts.",5,12,
ANAKIN,QUI-GON,558,I will.,1,2,
QUI-GON,ANAKIN,559,May the Force be with you.,1,6,
FODE,NA,560,Jabba the Hutt.,1,3,
JABBA,NA,561,Welcome. Begin the race!,2,4,
FODE,NA,562,"Hey, looks like they're clearing the grid.",2,7,
SHMI,QUI-GON,563,Is he nervous?,1,3,
QUI-GON,SHMI,564,He's fne.,1,2,
PADME,QUI-GON,565,You Jedi are far too reckless. The queen is not...,2,10,
QUI-GON,PADME,566,"The queen trusts my judgment, young handmaiden. You should too.",3,10,
PADME,QUI-GON,567,You assume too much.,1,4,
FODE,NA,568,Start your engines.,1,3,
JAR JAR,"PADME, QUI-GON, SHMI",569,"Oh, dissen gonna be messy. Me no watch'n!",2,8,
R2D2,"PADME, QUI-GON, SHMI",570,BEEP,1,1,
ANAKIN,ANAKIN,571,"Oh, no! Nooo!",1,3,
FODE,NA,572,Wait. Little Skywalker has stalled. It looks like Quadinaros is having engine trouble also.,4,14,
JAR JAR,NA,573,"Come on, Ani!",1,3,
FODE,NA,574,And there goes Skywalker!,1,4,
JAR JAR,NA,575,"Go, Ani, go!",1,3,
FODE,NA,576,He will be hard-pressed to catch up with the leaders. Looks like a few Tusken Raiders are camped out... on the canyon dune turn. There goes Quadinaros' power coupling.,7,29,
POD RACER,NA,577,"Oh, no!",1,2,
THREEPIO,"R2D2, KITSTER, GREEDO",578,Where is Master Anakin?,1,4,
PADME,"SHMI, QUI-GON, JAR JAR",579,Look. Here he comes.,1,4,
FODE,NA,580,It looks like Skywalker is moving up in the field.,2,10,
KITSTER,NA,581,Yay! Yippee!,1,2,
THREEPIO,R2D2,582,"He has to complete two more circuits? Oh, dear.",2,9,
FODE,NA,583,"Skywalker's spinning out of control! Oh, I don't care what universe you're from. That's gotta hurt!",4,16,
JAR JAR,"PADME, SHMI, QUI-GON",584,Here he comes!,1,3,
FODE,NA,585,"At the start of the third and final lap, Sebulba's in the lead... followed closely by Skywalker!",3,17,
KITSTER,NA,586,"Go, Ani!",1,2,
FODE,NA,587,Skywalker's been forced onto the service ramp! It's Skywalker!,3,9,
BEED,NA,588,"Sebulba! Amazing! A quick control thrust, and he's back on course!",3,11,
JAR JAR,"PADME, SHMI, QUI-GON",589,Did he crash-ed?,1,3,
FODE,NA,590,Skywalker's in trouble! Sebulba takes the lead! He's catching Sebulba!,3,10,
JAR JAR,NA,591,"Careful, Ani. Careful, Ani!",1,4,
FODE,NA,592,That little human being is out of his mind! They're side by side!,3,13,
KITSTER,NA,593,Yippee!,1,1,
GREEDO,NA,594,Yay!,1,1,
THREEPIO,R2D2,595,I can't believe it.,1,4,
FODE,NA,596,The crowds are going nuts!,1,5,
JAR JAR,ANAKIN,597,"Yay, Ani!",1,2,
ANAKIN,SHMI,598,"Mom, I did it! Yay!",1,5,
JAR JAR,ANAKIN,599,"Good going, Ani!",1,3,
PADME,ANAKIN,600,"We owe you everything, Ani.",1,5,
SHMI,ANAKIN,601,"It's so wonderful, Ani. You have brought hope to those who have none. I'm so very proud of you.",4,19,
WATTO,QUI-GON,602,You! You swindled me. You knew the boy was going to win. Somehow you knew it. I lost everything.,5,19,
QUI-GON,WATTO,603,"Whenever you gamble, my friend, eventually you lose. Bring the parts to the main hangar. I'll come by your shop later on so you can release the boy.",6,28,
WATTO,QUI-GON,604,You can't have him. It wasn't a fair bet.,2,9,
QUI-GON,WATTO,605,Would you like to discuss it with the Hutts? I'm sure they can settle this.,3,15,
WATTO,QUI-GON,606,Take him.,1,2,
JAR JAR,OBI-WAN,607,Hidoe!,1,1,
OBI-WAN,QUI-GON,608,"Well, we have all the essential parts we need.",2,9,
QUI-GON,OBI-WAN,609,I'm going back. Some unfinished business. I won't be long.,3,10,
OBI-WAN,QUI-GON,610,Why do I sense we've picked up another pathetic life-form?,2,10,
QUI-GON,OBI-WAN,611,It's the boy who's responsible for getting us these parts. Get this hyperdrive generator installed.,4,15,
OBI-WAN,QUI-GON,612,"Yes, Master. That shouldn't take long.",2,6,
QUI-GON,ANIMAL,613,Come on. Hup!,1,3,
QUI-GON,ANAKIN,614,Hey. These are yours.,1,4,
ANAKIN,ANAKIN,615,Yes!,1,1,
ANAKIN,SHMI,616,"Mom, we sold the pod! Look at all the money we have!",2,12,
SHMI,ANAKIN,617,"My goodness! But that's so wonderful, Ani.",2,7,
QUI-GON,"SHMI, ANAKIN",618,And he has been freed.,1,5,
ANAKIN,QUI-GON,619,What? ,1,1,
QUI-GON,ANAKIN,620,You're no longer a slave.,1,5,
ANAKIN,SHMI,621,Did you hear that?,1,4,
SHMI,ANAKIN,622,"Now you can make your dreams come true, Ani. You are free.",3,12,
SHMI,QUI-GON,623,Will you take him with you? Is he to become a Jedi?,2,12,
QUI-GON,SHMI,624,Yes. Our meeting was not a coincidence. Nothing happens by accident.,3,11,
ANAKIN,QUI-GON,625,You mean I get to come with you in your starship?,2,11,
QUI-GON,ANAKIN,626,"Anakin... training to become a Jedi is not an easy challenge... and even if you succeed, it's a hard life.",5,20,
ANAKIN,QUI-GON,627,But I wanna go. It's what I've always dreamed of doing.,2,11,
ANAKIN,SHMI,628,"Can I go, Mom?",1,4,
SHMI,ANAKIN,629,Anakin... this path has been placed before you. The choice is yours alone.,4,13,
ANAKIN,SHMI,630,I wanna do it.,1,4,
QUI-GON,ANAKIN,631,Then pack your things. We haven't much time.,2,8,
ANAKIN,ANAKIN,632,Yippee!,1,1,
ANAKIN,QUI-GON,633,What about Mom? Is she free too?,1,7,
QUI-GON,ANAKIN,634,"I tried to free your mother, Ani, but Watto wouldn't have it.",2,12,
ANAKIN,SHMI,635,"You're coming with us, aren't you, Mom?",2,7,
SHMI,ANAKIN,636,"Son, my place is here. My future is here. It is time for you to let go.",3,17,
ANAKIN,SHMI,637,I don't want things to change.,1,6,
SHMI,ANAKIN,638,But you can't stop the change... any more than you can stop the suns from setting. I love you. Now hurry.,5,21,
SHMI,QUI-GON,639,Thank you.,1,2,
QUI-GON,SHMI,640,I'll watch after him. You have my word. Will you be all right?,3,13,
SHMI,QUI-GON,641,Yeah.,1,1,
THREEPIO,ANAKIN,642,"Oh, Oh my. Oh! Hello, Master Anakin.",1,7,
ANAKIN,THREEPIO,643,"Well, 3PO, I've been freed... and I'm going away in a starship.",2,12,
THREEPIO,ANAKIN,644,"Master Anakin, you are my maker and I wish you well. However, I should prefer it if I were a little more completed.",4,23,
ANAKIN,THREEPIO,645,"I'm sorry I wasn't able to finish you, 3PO... give you coverings and all. I'm gonna miss working on you. You've been a great pal. I'll make sure Mom doesn't sell you or anything.",7,34,
THREEPIO,ANAKIN,646,Sell me?,1,2,
ANAKIN,THREEPIO,647,Bye.,1,1,
THREEPIO,ANAKIN,648,"Oh, my.",1,2,
ANAKIN,SHMI,649,"I can't do it, Mom. I just can't do it.",2,10,
SHMI,ANAKIN,650,Ani...,1,1,
ANAKIN,SHMI,651,Will I ever see you again?,1,6,
SHMI,ANAKIN,652,What does your heart tell you?,1,6,
ANAKIN,SHMI,653,I hope so. Yes. I guess.,3,6,
SHMI,ANAKIN,654,Then we will see each other again.,2,7,
ANAKIN,SHMI,655,"I will come back and free you, Mom. I promise.",3,10,
SHMI,ANAKIN,656,"Now, be brave... and don't look back. Don't look back.",3,10,
ANAKIN,QUI-GON,657,"Qui-Gon, sir, wait! I'm tired!",2,5,
QUI-GON,ANAKIN,658,Anakin! Drop! Go! Tell them to take off!,3,8,
CAPT. PANAKA,"RIC OLIE, OBI-WAN",659,Qui-Gon's in trouble.,1,3,
OBI-WAN,RIC OLIE,660,Take off. Over there. Fly low.,2,6,
ANAKIN,QUI-GON,661,Are you all right?,1,4,
QUI-GON,"ANAKIN, OBI-WAN",662,I think so.,1,3,
OBI-WAN,QUI-GON,663,What was it?,1,3,
QUI-GON,"OBI-WAN, ANAKIN",664,I'm not sure... but it was well-trained in the Jedi arts.,3,11,
R2D2,NA,665,BEEPS TWICE,1,2,
QUI-GON,OBI-WAN,666,My guess is it was after the queen.,2,8,
ANAKIN,QUI-GON,667,What are we gonna do about it?,1,7,
QUI-GON,ANAKIN,668,We shall be patient.,1,4,
QUI-GON,"ANAKIN, OBI-WAN",669,Anakin Skywalker... meet Obi-Wan Kenobi.,2,5,
ANAKIN,OBI-WAN,670,Hi! You're a Jedi too? Pleased to meet you.,2,9,
NUTE,BIBBLE,671,"Your queen is lost, your people are starving... and you, Governor, are going to die... much sooner than your people, I'm afraid.",6,22,
BIBBLE,NUTE,672,This invasion will gain you nothing. We're a democracy. The people have decided.,4,13,
NUTE,NA,673,Take him away.,1,3,
OOM-9,NUTE,674,My troops are in position to begin searching the swamps... for these rumoured underwater villages. They will not stay hidden for long.,6,22,
BIBBLE,PADME,675,The death toll is catastrophic. We must bow to their wishes. You must contact me.,3,15,recording
PADME,ANAKIN,676,You all right?,1,3,
ANAKIN,PADME,677,It's very cold.,1,3,
PADME,ANAKIN,678,"You come from a warm planet, Ani. A little too warm for my taste. Space is cold.",5,17,
ANAKIN,PADME,679,You seem sad.,1,3,
PADME,ANAKIN,680,"The queen is worried. Her people are suffering, dying. She must convince the senate to intervene or... I'm not sure what'll happen.",5,22,
ANAKIN,PADME,681,I made this for you... so you'd remember me. I carved it out of a japor snippet. It'll bring you good fortune.,5,22,
PADME,ANAKIN,682,"It's beautiful. But I don't need this to remember you by. Many things will change when we reach the capital, Ani... but my caring for you will remain.",6,28,
ANAKIN,PADME,683,"I care for you, too, only l...",1,7,
PADME,ANAKIN,684,Miss your mother.,1,3,
RIC OLIE,ANAKIN,685,Coruscant. The entire planet is one big city. There's Chancellor Valorum's shuttle. And look over there. Senator Palpatine is waiting for us.,5,22,
PALPATINE,SABE,686,"It is a great gift to see you alive, Your Majesty. With the communications breakdown, we've been very concerned. I'm anxious to hear your report on the situation. May I present Supreme Chancellor Valorum.",8,34,
VALORUM,SABE,687,"Welcome, Your Highness. It's an honour to fnally meet you in person.",3,12,
SABE,PALPATINE,688,"Thank you, Supreme Chancellor.",1,4,
VALORUM,SABE,689,I must relay to you how distressed everyone is over the current situation. I've called for a special session of the senate to hear your position.,4,26,
SABE,VALORUM,690,"I'm grateful for your concern, Chancellor.",2,6,
PALPATINE,SABE,691,There is a question of procedure... but I'm confdent we can overcome it.,4,13,
QUI-GON,VALORUM,692,I must speak with the Jedi Council immediately. The situation has become much more complicated.,4,15,
PADME,ANAKIN,693,"Ani, come on.",1,3,
JAR JAR,ANAKIN,694,"Da queen's a bein grossly nice, mesa tinks. Pitty hot.",3,10,
PALPATINE,PADME,695,"There is no civility, only politics. The Republic is not what it once was. The senate is full of greedy, squabbling delegates. There is no interest in the common good. I must be frank, Your Majesty. There is little chance the senate will act on the invasion.",11,47,
PADME,PALPATINE,696,"Chancellor Valorum seems to think there is hope. If I may say so, Your Majesty... the chancellor has little real power. He is mired by baseless accusations of corruption. The bureaucrats are in charge now. What options have we?",9,39,
