speaker,addressed,lineorder,combinedline,numberofrows,wordcount,mode
MACE WINDU,YODA,567,"It is done, then. I will take what Jedi we have left and go to Geonosis and help Obi-Wan.",3,19,
YODA,MACE WINDU,568,Visit I will the cloners on Kamino... and see this army they have created for the Republic.,4,17,
PADME,ANAKIN,569,See those columns of steam straight ahead? They're exhaust vents of some type.,4,13,
ANAKIN,PADME,570,That'll do.,1,2,
PADME,ANAKIN,571,"Look, whatever happens out there, follow my lead. I'm not interested in getting into a war here. As a member of the senate... maybe I can find a diplomatic solution to this mess.",8,33,
ANAKIN,PADME,572,Don't worry. I've given up trying to argue with you.,2,10,
R2D2,THREEPIO,573,"[ Whistling, Beeping ]",1,3,
THREEPIO,R2D2,574,"My obtuse little friend, if they had needed our help... they would have asked for it. You obviously have a great deal to learn about human behavior.",6,27,
R2D2,THREEPIO,575,[ Beeping ] [ Beeping ],2,2,
R2D2,THREEPIO,576,[ Beeping ],1,7,
THREEPIO,R2D2,577,For a mechanic... you seem to do an excessive amount of thinking.,3,12,
R2D2,THREEPIO,578,[ Beeping ],1,3,
THREEPIO,R2D2,579,I am programmed to understand humans!,2,6,
R2D2,THREEPIO,580,[ Beeping ],1,15,
THREEPIO,R2D2,581,What does that mean?'' Oh! That means I am in charge here!,2,12,
R2D2,THREEPIO,582,[ Raspberries ],1,2,
THREEPIO,R2D2,583,Where are you going now?,1,5,
THREEPIO,R2D2,584,You don't know what's out there. Have you no sense at all?,2,12,
THREEPIO,R2D2,585,Oh! Idiot! Please wait.,2,4,
R2D2,THREEPIO,586,[ Beeping ],1,4,
THREEPIO,R2D2,587,Do you know where you're going?,2,6,
ANAKIN,PADME,588,Wait.,1,1,
THREEPIO,R2D2,589,"Oh, my. Oh, oh oh!",1,5,
ANAKIN,PADME,590,Padme!,1,1,
THREEPIO,R2D2,591,"Oh, my goodness! Shut me down! Machines making machines. Huh! How perverse.",4,12,
THREEPIO,R2D2,592,"Oh! Calm down, R2.",2,4,
THREEPIO,R2D2,593,I almost fell. You'll get your chance--,2,7,
THREEPIO,THREEPIO,594,"Oh! I'm scrap. It's a nightmare! Oh, I want to go home! Oh, what did I do to deserve this?",5,20,
R2D2,R2D2,595,[ Beeping ] [ Whistling ],2,8,
THREEPIO,THREEPIO,596,"Hmm. I wonder what happened to poor little R2. He's always getting himself into trouble. Oops. Oh, no! Oh, I'm so confused.",6,22,
ANAKIN,ANAKIN,597,"Oh, not again. Obi-Wan's gonna kill me.",2,7,
JANGO FETT,ANAKIN,598,"Don't move, Jedi!",1,3,
JANGO FETT,NA,599,Take him away.,1,3,
ANAKIN,PADME,600,Don't be afraid.,1,3,
PADME,ANAKIN,601,I'm not afraid to die. I've been dying a little bit each day since you came back into my life.,3,20,
ANAKIN,PADME,602,What are you talking about?,1,5,
PADME,ANAKIN,603,I love you.,1,3,
ANAKIN,PADME,604,You love me? I thought that we had decided not to fall in love... that we would be forced to live a lie... and that it would destroy our lives.,7,30,
PADME,ANAKIN,605,"I think our lives are about to be destroyed anyway. I truly... deeply love you... and before we die, I want you to know.",6,24,
OBI-WAN,ANAKIN,606,I was beginning to wonder if you'd got my message.,2,10,
ANAKIN,OBI-WAN,607,"I retransmitted it just as you had requested, Master. Then we decided to come and rescue you.",4,17,
OBI-WAN,ANAKIN,608,Good job.,1,2,
POGGLE THE LESSER,GROUP,609,Settle down. Settle down. Let the executions begin.,2,8,
ANAKIN,OBI-WAN,610,I've got a bad feeling about this.,2,7,
OBI-WAN,ANAKIN,611,Just relax. Concentrate.,1,3,
ANAKIN,OBI-WAN,612,What about Padme?,1,3,
OBI-WAN,ANAKIN,613,She seems to be on top of things.,2,8,
NUTE,RUNE,614,She can't do that! Shoot her or-- or something!,2,9,
ANAKIN,PADME,615,Jump!,1,1,
NUTE,COUNT DOOKU,616,This isn't how it's supposed to be!,1,7,
NUTE,JANGO FETT,617,Jango! Finish her off!.,1,4,
COUNT DOOKU,NUTE,618,"Patience, Viceroy, patience. She will die.",2,6,
COUNT DOOKU,MACE WINDU,619,"Master Windu, how pleasant of you to join us.",2,9,
MACE WINDU,COUNT DOOKU,620,This party's over.,1,3,
COUNT DOOKU,MACE WINDU,621,"Brave but foolish, my old Jedi friend. You're impossibly outnumbered.",3,10,
MACE WINDU,COUNT DOOKU,622,I don't think so.,1,4,
COUNT DOOKU,MACE WINDU,623,We'll see.,1,2,
ROBOT,NA,624,My legs aren't moving. I must need maintenance.,2,8,
THREEPIO,THREEPIO,625,"What's all this noise? A battle! Oh, there's been some terrible mistake! I'm programmed for etiquette, not destruction!",6,18,
THREEPIO,GROUP,626,"Die, Jedi dogs!",1,3,
THREEPIO,THREEPIO,627,"Oh! What did I say? Oh, dear. I'm terribly sorry about all this.",3,13,
THREEPIO,NA,628,Excuse me. I'm trapped. I can't get up.,2,8,
ANAKIN,PADME,629,You call this a diplomatic solution?,2,6,
PADME,ANAKIN,630,"No, I call it aggressive negotiations.",2,6,
ROBOT,NA,631,"Roger, roger.",1,2,
R2D2,THREEPIO,632,[ Beeping ],1,6,
THREEPIO,R2D2,633,"R2, what are you doing here?",1,6,
R2D2,THREEPIO,634,[ Beeping ],1,7,
THREEPIO,R2D2,635,"What are you doing? Oh, stop that! You're going to strain something. My neck! Now where are you taking me?",5,20,
R2D2,THREEPIO,636,[ Beeping ],1,1,
THREEPIO,R2D2,637,"Oh, this is such a drag. Oh, I'm quite beside myself. R2, please be careful! You're singeing my circuits!",4,19,
R2D2,THREEPIO,638,[ Beeping ],1,6,
THREEPIO,R2D2,639,"Yes, but is my head on straight?",1,7,
COUNT DOOKU,MACE WINDU,640,"Master Windu, you have fought gallantly... worthy of recognition in the archives of the Jedi order. Now it is finished. Surrender, and your lives will be spared.",7,27,
MACE WINDU,COUNT DOOKU,641,"We will not be hostages to be bartered, Dooku!",2,9,
COUNT DOOKU,MACE WINDU,642,"Then, I'm sorry, old friend.",1,5,
PADME,GROUP,643,Look!,1,1,
YODA,GROUP,644,Around the survivors a perimeter create.,2,6,
R2D2,THREEPIO,645,"[ Beeping, Chirping ]",1,9,
THREEPIO,R2D2,646,"Oh, I've had the most peculiar dream.",2,7,
YODA,"MACE WINDO, KI-ADI-MUNDI",647,If Dooku escapes... rally more systems to his cause he will.,3,11,
OBI-WAN,"PADME, ANAKIN",648,Hold on!,1,2,
ANAKIN,NA,649,Aim right above the fuel cells!,2,6,
OBI-WAN,ANAKIN,650,"Good call, my young Padawan.",2,5,
NUTE,"COUNT DOOKU, POGGLE THE LESSER, RUNE",651,The Jedi have amassed a huge army.,1,7,
COUNT DOOKU,"NUTE, POGGLE THE LESSER",652,That doesn't seem possible. How could the Jedi come up with an army so quickly?,3,15,
NUTE,"COUNT DOOKU, POGGLE THE LESSER",653,We must send all available droids into battle.,2,8,
COUNT DOOKU,"NUTE, POGGLE THE LESSER",654,There are too many.,1,4,
POGGLE THE LESSER,"COUNT DOOKU, NUTE",655,Our communications have been jammed.,1,5,
MACE WINDU,PILOT,656,"Pilot, land in that assembly area!",1,6,
PILOT,MACE WINDU,657,"Yes, sir.",1,2,
COMMANDO CAPTAIN,NA,658,"Sir, I have five special commando units awaiting your orders, sir.",2,11,
YODA,NA,659,To the forward command center take me.,2,7,
OBI-WAN,NA,660,Attack those Federation starships! Quickly!,2,5,
COMMANDO CAPTAIN,YODA,661,"Master Yoda, all forward positions are advancing.",2,7,
YODA,COMMANDO CAPTAIN,662,Very good. Very good.,2,4,
NUTE,COUNT DOOKU,663,This is not looking good at all!,1,7,
RUNE,NUTE,664,We must get the starships back into space.,2,8,
POGGLE THE LESSER,COUNT DOOKU,665,We have to order a retreat.,1,6,
COUNT DOOKU,POGGLE THE LESSER,666,My master will never allow the Republic... to get away with this treachery.,4,13,
POGGLE THE LESSER,COUNT DOOKU,667,"I'm sending my warriors to hide in the catacombs. The Jedi must not find our designs for the ultimate weapon. If they find out what we are planning to build, we're doomed.",6,32,
COUNT DOOKU,POGGLE THE LESSER,668,I will take the designs with me to Coruscant. They will be much safer there with my master.,4,18,
YODA,COMMANDO CAPTAIN,669,Concentrate all your fire on the nearest starship.,2,8,
COMMANDO CAPTAIN,YODA,670,"Yes, sir.",1,2,
COMMANDO CAPTAIN,NA,671,Move all quadrants to sector 5-1 -5.,2,7,
OBI-WAN,ANAKIN,672,Look over there!,1,3,
ANAKIN,OBI-WAN,673,It's Dooku!,1,2,
ANAKIN,COMMANDO CAPTAIN,674,Shoot him down!,1,3,
COMMANDO CAPTAIN,ANAKIN,675,"We're out of rockets, sir.",1,5,
ANAKIN,COMMANDO CAPTAIN,676,Follow him!,1,2,
PADME,"ANAKIN, OBI-WAN",677,We're gonna need some help!,1,5,
OBI-WAN,"PADME, ANAKIN",678,There isn't time! Anakin and I can handle this!,2,9,
ANAKIN,PADME,679,Padme!,1,1,
ANAKIN,COMMANDO CAPTAIN,680,Put the ship down!,1,4,
OBI-WAN,ANAKIN,681,Anakin! Don't let your personal feelings get in the way! Follow that speeder!,3,13,
ANAKIN,COMMANDO CAPTAIN,682,Lower the ship!,1,3,
OBI-WAN,ANAKIN,683,"I can't take Dooku alone! I need you! If we catch him, we can end this war right now! We have a job to do!",4,25,
ANAKIN,OBI-WAN,684,I don't care! ,2,3,
ANAKIN,COMMANDO CAPTAIN,685,Put the ship down!,,4,
OBI-WAN,ANAKIN,686,You will be expelled from the Jedi order!,2,8,
ANAKIN,OBI-WAN,687,I can't leave her!,1,4,
OBI-WAN,ANAKIN,688,Come to your senses! What do you think Padme would do were she in your position?,3,16,
ANAKIN,OBI-WAN,689,She would do her duty.,1,5,
COMMANDO CAPTAIN,YODA,690,The droid army is in full retreat.,2,7,
YODA,NA,691,"Well done, Commander. Bring me a ship.",2,7,
ANAKIN,COUNT DOOKU,692,"You're gonna pay for all the Jedi that you killed today, Dooku.",2,12,
OBI-WAN,ANAKIN,693,We'll take him together. Go in slowly on the left.,2,10,
ANAKIN,OBI-WAN,694,I'm taking him now!,1,4,
OBI-WAN,ANAKIN,695,"No, Anakin! No! No!",1,4,
COUNT DOOKU,OBI-WAN,696,"As you see, my Jedi powers are far beyond yours. Now... back down.",3,13,
OBI-WAN,COUNT DOOKU,697,I don't think so.,1,4,
COUNT DOOKU,OBI-WAN,698,"Master Kenobi, you disappoint me. Yoda holds you in such high esteem. Surely you can do better.",5,17,
COMMANDO CAPTAIN,PADME,699,Are you all right?,1,4,
PADME,COMMANDO CAPTAIN,700,Uh-huh.,1,1,
COMMANDO CAPTAIN,PADME,701,We'd better get back to the forward command center.,2,9,
PADME,COMMANDO CAPTAIN,702,No. No. Gather what troops you can. We've got to get to that hangar. Get a transport. Hurry!,4,18,
COMMANDO CAPTAIN,PADME,703,Right away.,1,2,
COUNT DOOKU,ANAKIN,704,"Brave of you, boy. But I would have thought you had learned your lesson.",3,14,
ANAKIN,COUNT DOOKU,705,I am a slow learner.,1,5,
OBI-WAN,ANAKIN,706,Anakin!,1,1,
COUNT DOOKU,YODA,707,Master Yoda.,1,2,
YODA,COUNT DOOKU,708,Count Dooku.,1,2,
COUNT DOOKU,YODA,709,You have interfered with our affairs for the last time.,2,10,
YODA,COUNT DOOKU,710,"Powerful you have become, Dooku. The dark side I sense in you.",3,12,
COUNT DOOKU,YODA,711,I've become more powerful than any Jedi. Even you.,3,9,
YODA,COUNT DOOKU,712,Much to learn you still have.,1,6,
COUNT DOOKU,YODA,713,It is obvious that this contest cannot be decided by our knowledge of the Force... but by our skills with a lightsaber.,5,22,
YODA,COUNT DOOKU,714,"Fought well you have, my old Padawan.",2,7,
COUNT DOOKU,YODA,715,This is just the beginning.,1,5,
PADME,ANAKIN,716,Anakin!,1,1,
COUNT DOOKU,PALPATINE,717,"The Force is with us, Master Sidious.",2,7,
PALPATINE,COUNT DOOKU,718,"Welcome home, Lord Tyranus. You have done well.",3,8,
COUNT DOOKU,PALPATINE,719,"I have good news for you, my lord. The war has begun.",3,12,
PALPATINE,COUNT DOOKU,720,Excellent. Everything is going as planned.,3,6,
OBI-WAN,"MACE WINDU, YODA",721,Do you believe what Count Dooku said... about Sidious controlling the senate? It doesn't feel right.,5,16,
YODA,"OBI-WAN, MACE WINDU",722,"Joined the dark side Dooku has. Lies, deceit... creating mistrust are his ways now.",5,14,
MACE WINDU,"OBI-WAN, YODA",723,"Nevertheless, I feel we should keep a closer eye on the senate.",2,12,
YODA,"OBI-WAN, MACE WINDU",724,I agree.,1,2,
MACE WINDU,OBI-WAN,725,Where is your apprentice?,1,4,
OBI-WAN,MACE WINDU,726,"On his way to Naboo, escorting Senator Amidala home.",2,9,
OBI-WAN,"MACE WINDU, YODA",727,"I have to admit that without the clones, it would not have been a victory.",3,15,
YODA,OBI-WAN,728,"Victory? Victory, you say? Master Obi-Wan, not victory. The shroud of the dark side has fallen. Begun the Clone War has.",7,21,
