speaker,addressed,lineorder,combinedline,numberofrows,wordcount,mode
LAMA SU,OBI-WAN,291,"I trust you're going to enjoy your stay. Please. And now to business. You will be delighted to hear that we are on schedule. 200,000 units are ready... with a million more well on the way.",9,36,
OBI-WAN,"LAMA SU, TAUN WE",292,That's good news.,1,3,
LAMA SU,OBI-WAN,293,Please tell your Master Sifo-Dyas... that his order will be met on time.,4,13,
OBI-WAN,LAMA SU,294,I'm sorry. Master--,1,3,
LAMA SU,OBI-WAN,295,Jedi Master Sifo-Dyas is still a leading member of the Jedi Council... is he not?,3,15,
OBI-WAN,LAMA SU,296,Master Sifo-Dyas was killed almost ten years ago.,2,8,
LAMA SU,OBI-WAN,297,"Oh, I'm so sorry to hear that. But I'm sure he would have been proud of the army we've built for him.",4,22,
OBI-WAN,LAMA SU,298,The army?,1,2,
LAMA SU,OBI-WAN,299,"Yes. A clone army, and I must say, one of the finest we've ever created.",3,15,
OBI-WAN,LAMA SU,300,"Tell me, Prime Minister... when my master first contacted you about the army... did he say who it was for?",5,20,
LAMA SU,OBI-WAN,301,Of course he did. This army is for the Republic. But you must be anxious to inspect the units for yourself.,5,21,
OBI-WAN,LAMA SU,302,That's why I'm here.,1,4,
PADME,ANAKIN,303,We used to come here for school retreat. We would swim to that island every day. I love the water. We used to lie out on the sand and let the sun dry us... and try to guess the names of the birds singing.,9,44,
ANAKIN,PADME,304,"I don't like sand. It's coarse and rough and irritating... and it gets everywhere. Not like here. Here, everything is soft... and smooth.",7,23,
PADME,ANAKIN,305,No. I shouldn't have done that.,2,6,
ANAKIN,PADME,306,I'm sorry.,1,2,
OBI-WAN,LAMA SU,307,Very impressive.,1,2,
LAMA SU,OBI-WAN,308,I'd hoped you would be pleased. Clones can think creatively. You will find that they are immensely superior to droids. We take great pride in our combat education and training programs. This group was created about five years ago.,8,39,
OBI-WAN,LAMA SU,309,You mentioned growth acceleration.,2,4,
LAMA SU,OBI-WAN,310,"Oh,yes, it's essential. Otherwise, a mature clone would take a lifetime to grow. Now we can do it in half the time.",5,22,
OBI-WAN,LAMA SU,311,I see.,1,2,
LAMA SU,OBI-WAN,312,They are totally obedient... taking any order without question. We modified their genetic structure... to make them less independent than the original host.,7,23,
OBI-WAN,LAMA SU,313,And who was the original host?,2,6,
LAMA SU,OBI-WAN,314,A bounty hunter called Jango Fett.,2,6,
OBI-WAN,LAMA SU,315,And where is this bounty hunter now?,2,7,
LAMA SU,OBI-WAN,316,"Oh, we keep him here. Apart from his pay, which is considerable... Fett demanded only one thing: an unaltered clone for himself. Curious, isn't it?",8,25,
OBI-WAN,LAMA SU,317,Unaltered?,1,1,
LAMA SU,OBI-WAN,318,Pure genetic replication. No tampering with the structure to make it more docile... and no growth acceleration.,4,17,
OBI-WAN,LAMA SU,319,I should very much like to meet this Jango Fett.,2,10,
TAUN WE,OBI-WAN,320,I would be very happy to arrange it.,2,8,
LAMA SU,OBI-WAN,321,"Magnificent, aren't they?",1,3,
PADME,ANAKIN,322,I don't know.,1,3,
ANAKIN,PADME,323,Sure you do. You just don't want to tell me.,2,10,
PADME,ANAKIN,324,You gonna use one of your Jedi mind tricks on me?,2,11,
ANAKIN,PADME,325,They only work on the weak-minded.,2,6,
PADME,ANAKIN,326,"All right. I was twelve. His name was Palo. We were both in the Legislative Youth Program. He was a few years older than I. Very cute. Dark, curly hair. Dreamy eyes.",8,32,
ANAKIN,PADME,327,"All right, I get the picture. Whatever happened to him?",2,10,
PADME,ANAKIN,328,I went into public service; he went on to become an artist.,2,12,
ANAKIN,PADME,329,Maybe he was the smart one.,1,6,
PADME,ANAKIN,330,"You really don't like politicians, do you?",2,7,
ANAKIN,PADME,331,I like two or three... but I'm not really sure about one of them. I don't think the system works.,5,20,
PADME,ANAKIN,332,How would you have it work?,2,6,
ANAKIN,PADME,333,"We need a system where the politicians sit down and discuss the problem... agree what's in the best interest of all the people, and then do it.",4,27,
PADME,ANAKIN,334,That's exactly what we do. The trouble is that people don't always agree.,4,13,
ANAKIN,PADME,335,"Well, then they should be made to.",2,7,
PADME,ANAKIN,336,By whom? Who's gonna make them?,1,6,
ANAKIN,PADME,337,I don't know. Someone.,1,4,
PADME,ANAKIN,338,You?,1,1,
ANAKIN,PADME,339,Of course not me.,1,4,
PADME,ANAKIN,340,But someone.,1,2,
ANAKIN,PADME,341,Someone wise.,1,2,
PADME,ANAKIN,342,Sounds an awful lot like a dictatorship to me.,2,9,
ANAKIN,PADME,343,"Well, if it works.",1,4,
PADME,ANAKIN,344,You're making fun of me.,1,5,
ANAKIN,PADME,345,No. I'd be much too frightened to tease a senator.,3,10,
ANAKIN,NA,346,"Whoa, whoa. Oh, whoa!",1,4,
PADME,ANAKIN,347,"Ani! Ani, are you all right?",1,6,
TAUN WE,BOBA FETT,348,"Boba, is your father here?",1,5,
BOBA FETT,TAUN WE,349,Yep.,1,1,
TAUN WE,BOBA FETT,350,May we see him?,1,4,
BOBA FETT,TAUN WE,351,Sure.,1,1,
BOBA FETT,JANGO FETT,352,"Dad, Taun We's here.",1,4,
TAUN WE,JANGO FETT,353,"Jango, welcome back. Was your trip productive?",2,7,
JANGO FETT,TAUN WE,354,Fairly.,1,1,
TAUN WE,JANGO FETT,355,This is Jedi Master Obi-Wan Kenobi. He's come to check on our progress.,4,13,
OBI-WAN,JANGO FETT,356,Your clones are very impressive. You must be very proud.,2,10,
JANGO FETT,OBI-WAN,357,I'm just a simple man trying to make my way in the universe.,2,13,
OBI-WAN,JANGO FETT,358,Ever made your way as far into the interior as Coruscant?,2,11,
JANGO FETT,OBI-WAN,359,Once or twice.,1,3,
OBI-WAN,JANGO FETT,360,Recently?,1,1,
JANGO FETT,OBI-WAN,361,Possibly.,1,1,
OBI-WAN,JANGO FETT,362,Then you must know Master Sifo-Dyas.,2,6,
JANGO FETT,BOBA FETT,363,"Boba, rood eht so-heeck.",2,4,
JANGO FETT,OBI-WAN,364,Master who?,1,2,
OBI-WAN,JANGO FETT,365,Sifo-Dyas. Is he not the Jedi who hired you for this job?,3,12,
JANGO FETT,OBI-WAN,366,Never heard of him.,1,4,
OBI-WAN,JANGO FETT,367,Really?,1,1,
JANGO FETT,OBI-WAN,368,I was recruited by a man called Tyranus on one of the moons of Bogden.,2,15,
OBI-WAN,JANGO FETT,369,Curious.,1,1,
JANGO FETT,OBI-WAN,370,Do you like your army?,1,5,
OBI-WAN,JANGO FETT,371,I look forward to seeing them in action.,2,8,
JANGO FETT,OBI-WAN,372,They'll do their job well. I'll guarantee that.,2,8,
OBI-WAN,JANGO FETT,373,"Thank you for your time, Jango.",2,6,
JANGO FETT,OBI-WAN,374,Always a pleasure to meet a Jedi.,2,7,
BOBA FETT,JANGO FETT,375,"What is it, Dad?",1,4,
JANGO FETT,BOBA FETT,376,Pack your things. We're leaving.,2,5,
ANAKIN,PADME,377,"And when I got to them, we went into aggressive negotiations.",2,11,
ANAKIN,NA,378,Thank you.,1,2,
PADME,ANAKIN,379,Aggressive negotiations? What's that?,2,4,
ANAKIN,PADME,380,"Uh, well, negotiations with a lightsaber.",2,6,
PADME,ANAKIN,381,Oh.,1,1,
ANAKIN,PADME,382,"If Master Obi-Wan caught me doing this, he'd be very grumpy. From the moment I met you... all those years ago... not a day has gone by when I haven't thought of you. And now that I'm with you again... I'm in agony. The closer I get to you, the worse it gets. The thought of not being with you-- I can't breathe. I'm haunted by the kiss that you should never have given me. My heart is beating... hoping that that kiss will not become a scar. You are in my very soul... tormenting me. What can I do? I will do anything that you ask. If you are suffering as much as I am, please, tell me.",26,119,
PADME,ANAKIN,383,I can't. We can't. It's...just not possible.,3,7,
ANAKIN,PADME,384,"Anything is possible, Padme. Listen to me.",2,7,
PADME,ANAKIN,385,"No, you listen. We live in a real world. Come back to it. You're studying to become a Jedi. I'm- I'm a senator. If you follow your thoughts through to conclusion... it'll take us to a place we cannot go... regardless of the way we feel about each other.",11,49,
ANAKIN,PADME,386,Then you do feel something.,1,5,
PADME,ANAKIN,387,I will not let you give up your future for me.,2,11,
ANAKIN,PADME,388,"You are asking me to be rational. That is something I know I cannot do. Believe me, I wish that I could just wish away my feelings... but I can't.",7,30,
PADME,ANAKIN,389,I will not give in to this.,1,7,
ANAKIN,PADME,390,"Well, you know, it... wouldn't have to be that way. We could keep it a secret.",4,16,
PADME,ANAKIN,391,"We'd be living a lie... one we couldn't keep even if we wanted to. I couldn't do that. Could you, Anakin? Could you live like that?",6,26,
ANAKIN,PADME,392,No. You're right. It would destroy us.,2,7,
TAUN WE,OBI-WAN,393,"Tell your council that the first battalions are ready. And remind them, if they need more troops... it will take more time to grow them.",6,25,
OBI-WAN,TAUN WE,394,"I won't forget, and thank you.",1,6,
TAUN WE,OBI-WAN,395,Thank you.,1,2,
OBI-WAN,R4,396,"R4! Scramble code five to Coruscant, care of the old folks' home!",3,12,
OBI-WAN,"YODA, MACE WINDU",397,I have successfully made contact with the prime minister of Kamino. They are using a bounty hunter named Jango Fett to create a clone army. I have a strong feeling that this bounty hunter... is the assassin we are looking for.,8,41,
MACE WINDU,OBI-WAN,398,Do you think these cloners are involved in the plot to assassinate Senator Amidala?,3,14,
OBI-WAN,MACE WINDU,399,"No, Master. There appears to be no motive.",2,8,
YODA,OBI-WAN,400,"Do not assume anything, Obi-Wan. Clear your mind must be... if you are to discover the real villains behind this plot.",5,21,
OBI-WAN,YODA,401,"Yes, Master.",1,2,
OBI-WAN,"YODA, MACE WINDU",402,They say Master Sifo-Dyas placed an order for a clone army... at the request of the senate almost ten years ago. I was under the impression he was killed before that. Did the council ever authorize the creation of a clone army?,8,42,
MACE WINDU,OBI-WAN,403,No. Whoever placed that order did not have the authorization of the Jedi Council.,3,14,
YODA,OBI-WAN,404,Bring him here. Question him we will.,2,7,
OBI-WAN,YODA,405,"Yes, Master. I will report back when I have him.",2,10,
YODA,MACE WINDU,406,Blind we are if creation of this clone army... we could not see.,3,13,
MACE WINDU,YODA,407,I think it is time we informed the senate... that our ability to use the Force has diminished.,4,18,
YODA,MACE WINDU,408,Only the dark lord of the Sith knows of our weakness. If informed the senate is... multiply our adversaries will.,4,20,
ANAKIN,ANAKIN,409,No. No.,2,2,
SHMI,NA,410,"Anakin, help me.",1,3,
ANAKIN,NA,411,"Mom, no.",1,2,
SHMI,NA,412,Anakin!,1,1,
ANAKIN,NA,413,Don't. No. No.,2,3,
ANAKIN,PADME,414,Don't go.,1,2,
PADME,ANAKIN,415,I don't want to disturb you.,1,6,
ANAKIN,PADME,416,Your presence is soothing.,1,4,
PADME,ANAKIN,417,You had another nightmare last night.,2,6,
ANAKIN,PADME,418,Jedi don't have nightmares.,1,4,
PADME,ANAKIN,419,I heard you.,1,3,
ANAKIN,PADME,420,"I saw my mother. She is suffering, Padme. I saw her as clearly as I see you now. She is in pain. I know I'm disobeying my mandate to protect you, Senator... but I have to go. I have to help her.",9,42,
PADME,ANAKIN,421,I'll go with you.,1,4,
ANAKIN,PADME,422,I'm sorry. I don't have a choice.,2,7,
BOBA FETT,JANGO FETT,423,"Dad, look!",1,2,
JANGO FETT,BOBA FETT,424,"Boba, get on board!",1,4,
OBI-WAN,OBI-WAN,425,"Oh, not good.",1,3,
ANAKIN,NA,426,Wait right there.,1,3,
ROBOT,ANAKIN,427,Okey-okey.,1,1,
WATTO,ANAKIN,428,Da wanga!,1,2,
ANAKIN,WATTO,429,"Chut-chut, Watto. Let me help you with that.",2,8,
WATTO,ANAKIN,430,"What? What do you want? Wait! You're a Jedi! Whatever it is, I didn't do it.",3,16,
ANAKIN,WATTO,431,I'm looking for Shmi Skywalker.,1,5,
WATTO,ANAKIN,432,"Ani? Little Ani? Nahhh. You are Ani! It is you! You sure sprouted, huh? A Jedi! What do ya know! Hey... maybe you could help with some deadbeats who owe me a lot of money.",9,35,
ANAKIN,WATTO,433,My mother.,1,2,
WATTO,ANAKIN,434,"Oh, yeah. Shmi. she's not mine no more. I sold her.",3,11,
ANAKIN,WATTO,435,You sold her?,1,3,
WATTO,ANAKIN,436,"Years ago. Sorry, Ani, but you know, business is business, huh? Yeah, I sold her to a moisture farmer named, uh, Lars. At least I think it was Lars. Believe it or not, I heard he freed her and married her! Can ya beat that, eh? Yeah.",11,47,
ANAKIN,WATTO,437,Do you know where they are now?,2,7,
WATTO,ANAKIN,438,"Long way from here. Someplace over on the other side of Mos Eisley, I think.",4,15,
ANAKIN,WATTO,439,I'd like to know.,1,4,
WATTO,ANAKIN,440,Sure. Absolutely! Let's go look at my records?,3,8,
BOBA FETT,JANGO FETT,441,Dad! I think we're being tracked!,2,6,
JANGO FETT,BOBA FETT,442,"He must have put a homing device on our hull. Hang on, son. We'll move into the asteroid field... and we'll have a couple of surprises for him.",6,28,
OBI-WAN,R4,443,Seismic charges! Stand by.,2,4,
JANGO FETT,BOBA FETT,444,"He doesn't seem to take a hint, this guy.",2,9,
BOBA FETT,JANGO FETT,445,"Watch out! Get him, Dad! Get him! Fire!",2,8,
OBI-WAN,OBI-WAN,446,"Oh, blast! This is why I hate flying!",2,8,
BOBA FETT,JANGO FETT,447,We got him!,1,3,
JANGO FETT,BOBA FETT,448,We'll just have to finish him.,1,6,
OBI-WAN,R4,449,"R4, prepare to jettison the spare part canisters. Fire them now!",3,11,
JANGO FETT,BOBA FETT,450,"Well, we won't be seeing him again.",1,7,
OBI-WAN,R4,451,"Well, R4, I think we've waited long enough. There's an unusual concentration of Federation ships over there, R4.",4,18,
R2D2,"PADME, ANAKIN",452,"[Whistles, Beeps ]",1,3,
PADME,R2D2,453,"Stay with the ship, R2.",1,5,
R2D2,PADME,454,[ Beeping ],1,1,
THREEPIO,"ANAKIN, PADME",455,"Oh! Um, uh, hello. How might I be of service? I am C--",3,13,
ANAKIN,THREEPIO,456,Threepio?,1,1,
THREEPIO,ANAKIN,457,"Oh-- The maker! Oh, Master Ani! I knew you would return. I knew it!",5,14,
THREEPIO,PADME,458,"And Miss Padme. Oh, my.",1,5,
PADME,THREEPIO,459,"Hello, 3PO.",1,2,
THREEPIO,"THREEPIO, ANAKIN, PADME",460,Bless my circuits!,1,3,
THREEPIO,"ANAKIN, PADME",461,I'm so pleased to see you both.,1,7,
ANAKIN,THREEPIO,462,I've come to see my mother.,1,6,
THREEPIO,"ANAKIN, PADME",463,Oh. I think perhaps we'd better go indoors.,2,8,
THREEPIO,"OWEN LARS, ANAKIN, PADME",464,"Master Owen, might I present two most important visitors.",2,9,
ANAKIN,OWEN LARS,465,I'm Anakin Skywalker.,1,3,
OWEN LARS,"ANAKIN, PADME",466,"Owen Lars. Uh, this is my girlfriend, Beru.",2,8,
BERU,"ANAKIN, PADME",467,Hello.,1,1,
PADME,"OWEN, BERU",468,I'm Padme.,1,2,
OWEN LARS,ANAKIN,469,I guess I'm your stepbrother. I had a feeling you might show up someday.,4,14,
ANAKIN,OWEN LARS,470,Is my mother here?,1,4,
CLIEGG LARS,ANAKIN,471,"No, she's not. Cliegg Lars. Shmi is my wife. We should go inside. We have a lot to talk about.",5,20,
CLIEGG LARS,"ANAKIN, PADME",472,"It was just before dawn. They came out of nowhere. A hunting party of Tusken Raiders. Your mother had gone out early, like she always did... to pick mushrooms that grow on the vaporators. From the tracks, she was about halfway home... when they took her. Those Tuskens walk like men... but they're vicious, mindless monsters. Thirty of us went out after her. Four of us came back. I'd be out there with them, but after I lost my leg... I just couldn't ride anymore until I heal. I don't want to give up on her... but she's been gone a month. There's little hope she's lasted this long.",25,109,
OWEN LARS,ANAKIN,473,Where are you going?,1,4,
ANAKIN,OWEN LARS,474,To find my mother.,1,4,
CLIEGG LARS,ANAKIN,475,"Your mother's dead, son. Accept it.",2,6,
ANAKIN,PADME,476,"You're gonna have to stay here. These are good people, Padme. You'll be safe.",3,14,
PADME,ANAKIN,477,Anakin--,1,1,
ANAKIN,PADME,478,I won't be long.,1,4,
COUNT DOOKU,NUTE,479,We must persuade,1,3,
COUNT DOOKU,NUTE,480,the Commerce Guild... and the Corporate Alliance to sign the treaty.,3,11,
NUTE,COUNT DOOKU,481,What about the senator from Naboo? Is she dead yet? I am not signing your treaty until I have her head on my desk.,5,24,
COUNT DOOKU,NUTE,482,"I am a man of my word, Viceroy.",1,8,
ALIEN,NA,483,With these new battle droids we've built for you... you'll have the finest army in the galaxy.,4,17,
COUNT DOOKU,NA,484,"As I explained to you earlier... I am quite convinced that 10,000 more systems... will rally to our cause with your support, gentlemen.",5,23,
ALIEN,NA,485,What you are proposing could be construed as treason.,2,9,
CYBORG,NA,486,"The Techno Union army... is at your disposal, Count.",2,9,
ALIEN 2,NA,487,The Banking Clan will sign your treaty.,2,7,
COUNT DOOKU,NA,488,Good. Very good. Our friends from the Trade Federation have pledged their support... and when their battle droids are combined with yours... we shall have an army greater than any in the galaxy. The Jedi will be overwhelmed. The Republic will agree to any demands we make.,11,47,
ANAKIN,SHMI,489,Mom. Mom? Mom?,2,3,
SHMI,ANAKIN,490,Ani? Ani? Is it you?,2,5,
ANAKIN,SHMI,491,"I'm here, Mom. You're safe.",2,5,
SHMI,ANAKIN,492,"Ani? Ani? Oh, you look so handsome. My son. Oh, my grown-up son. I'm so proud of you, Ani.",7,19,
ANAKIN,SHMI,493,I missed you.,1,3,
SHMI,ANAKIN,494,Now I am complete. I love-,2,6,
ANAKIN,SHMI,495,"Stay with me, Mom. Everything--",2,5,
SHMI,ANAKIN,496,I love-- I-- I love--,2,5,
QUI-GON,NA,497,Anakin! Anakin!,1,2,
??? OTHER VOICE,NA,498,No-o-o!,1,1,
MACE WINDU,YODA,499,What is it?,1,3,
YODA,MACE WINDU,500,"Pain, suffering... death I feel. Something terrible has happened. Young Skywalker is in pain. Terrible pain.",6,16,
OBI-WAN,OBI-WAN,501,"The transmitter is working, but we're not receiving a return signal. Coruscant's too far.",3,14,
OBI-WAN,R4,502,"R4, can you boost the power? We'll have to try something else. Maybe we can contact Anakin on Naboo. It's much closer.",4,22,
OBI-WAN,NA,503,"Anakin? Anakin, do you copy? This is Obi-Wan Kenobi. Anakin?",4,10,
OBI-WAN,R4,504,"He's not on Naboo, R4. I'm going to try and widen the range. I do hope nothing's happened to him. That's Anakin's tracking signal, all right... but it's coming from Tatooine. What in the blazes is he doing there? I told him to stay on Naboo. We haven't got much time.",14,51,
OBI-WAN,NA,505,"Anakin? Anakin, do you copy? This is Obi-Wan Kenobi. Retransmit this message-- Anakin, do you copy? Anakin-- My long-range-- has been knocked out. Retransmit this message to Coruscant.",9,28,
PADME,ANAKIN,506,I brought you something. Are you hungry?,2,7,
ANAKIN,PADME,507,The shifter broke. Life seems so much simpler when you're fixing things. I'm good at fixing things. Always was. But I couldn't-- Why'd she have to die? Why couldn't I save her? I know I could have!,9,37,
PADME,ANAKIN,508,"Sometimes there are things no one can fix. You're not all-powerful, Ani.",3,12,
ANAKIN,PADME,509,"Well, I should be! Someday I will be. I will be the most powerful Jedi ever! I promise you. I will even learn to stop people from dying.",7,28,
PADME,ANAKIN,510,Anakin.,1,1,
ANAKIN,PADME,511,It's all Obi-Wan's fault! He's jealous! He's holding me back!,3,10,
PADME,ANAKIN,512,"What's wrong, Ani?",1,3,
ANAKIN,PADME,513,"I-- I killed them. I killed them all. They're dead. Every single one of them. And not just the men... but the women... and the children too. They're like animals, and I slaughtered them like animals! I hate them!",11,39,
PADME,ANAKIN,514,To be angry is to be human.,2,7,
ANAKIN,PADME,515,I'm a Jedi. I know I'm better than this.,2,9,
CLIEGG LARS,NA,516,"I know wherever you are it's become a better place. You were the most loving partner a man could ever have. Good-bye, my darling wife. And thank you.",6,28,
ANAKIN,NA,517,"I wasn't strong enough to save you, Mom. I wasn't strong enough. But I promise I won't fail again. I miss you... so much.",7,24,
R2D2,"PADME, ANAKIN",518,[ Beeping ],1,6,
PADME,R2D2,519,R2? What are you doing here?,2,6,
R2D2,"PADME, ANAKIN",520,[ Beeping ],1,5,
THREEPIO,"PADME, ANAKIN",521,It seems that he is carrying a message from an Obi-Wan Kenobi.,2,12,
THREEPIO,ANAKIN,522,"Master Ani, does that name mean anything to you?",2,9,
R2D2,"THREEPIO, PADME, ANAKIN",523,[ Beeping ],1,4,
OBI-WAN,"ANAKIN, PADME, YODA, MACE WINDU, JAR JAR, BAIL ORGANA, PALPATINE, MAS AMEDDA",524,"Anakin, my long-range transmitter has been knocked out. Retransmit this message to Coruscant. I have tracked the bounty hunter, Jango Fett... to the droid foundries on Geonosis. The Trade Federation is to take delivery of a droid army here... and it is clear that Viceroy Gunray... is behind the assassination attempts on Senator Amidala. The Commerce Guilds and the Corporate Alliance... have both pledged their armies to Count Dooku and are forming a-- Wait. Wait.",19,75,recording
YODA,MACE WINDU,525,"More happening on Geonosis, I feel, than has been revealed.",2,10,
MACE WINDU,YODA,526,I agree.,1,2,
MACE WINDU,ANAKIN,527,"Anakin, we will deal with Count Dooku. The most important thing for you is to stay where you are. Protect the senator at all costs. That is your first priority.",7,30,
ANAKIN,MACE WINDU,528,"Understood, Master.",1,2,
PADME,ANAKIN,529,They'll never get there in time to save him. They have to come halfway across the galaxy. Look. Geonosis is less than a parsec away.,6,25,
ANAKIN,PADME,530,If he's still alive.,1,4,
PADME,ANAKIN,531,"Ani, are you just gonna sit here and let him die? He's your friend, your mentor. He's--",3,17,
ANAKIN,PADME,532,He's like my father! But you heard Master Windu. He gave me strict orders to stay here!,3,17,
PADME,ANAKIN,533,"He gave you strict orders to protect me... and I'm going to help Obi-Wan. If you plan to protect me, you'll just have to come along.",5,26,
R2D2,THREEPIO,534,BEEPS THREE TIMES,1,3,
THREEPIO,R2D2,535,"I'm not worried, R2. It's just I've never flown before.",2,10,
BAIL ORGANA,"PALPATINE, SENATOR ASK AAK, MAS AMEDDA, JAR JAR, YODA, MACE WINDU",536,The Commerce Guilds are preparing for war. There can be no doubt of that.,2,14,
PALPATINE,"BAIL ORGANA, SENATOR ASK AAK, MAS AMEDDA, JAR JAR, YODA, MACE WINDU",537,Count Dooku must have made a treaty with them.,2,9,
SENATOR ASK AAK,"BAIL ORGANA, PALPATINE, MAS AMEDDA, JAR JAR, YODA, MACE WINDU",538,The debate is over. Now we need that clone army.,2,10,
BAIL ORGANA,"PALPATINE, SENATOR ASK AAK, MAS AMEDDA, JAR JAR, YODA, MACE WINDU",539,"Unfortunately, the debate is not over. The senate will never approve the use of clones before the separatists attack.",4,19,
MAS AMEDDA,"BAIL ORGANA, PALPATINE, SENATOR ASK AAK, JAR JAR, YODA, MACE WINDU",540,This is a crisis. The senate must vote the chancellor emergency powers. He can then approve the creation of an army.,5,21,
PALPATINE,"BAIL ORGANA, SENATOR ASK AAK, MAS AMEDDA, JAR JAR, YODA, MACE WINDU",541,But what senator would have the courage to propose such a radical amendment?,2,13,
MAS AMEDDA,"BAIL ORGANA, PALPATINE, MAS AMEDDA, JAR JAR, SENATOR ASK AAK, YODA, MACE WINDU",542,If only... Senator Amidala were here.,2,6,
OBI-WAN,COUNT DOOKU,543,Traitor.,1,1,
COUNT DOOKU,OBI-WAN,544,"Oh, no, my friend. This is a mistake, a terrible mistake. They have gone too far. This is madness.",4,19,
OBI-WAN,COUNT DOOKU,545,"I thought you were the leader here, Dooku.",2,8,
COUNT DOOKU,OBI-WAN,546,"This had nothing to do with me, I assure you. I will petition immediately to have you set free.",4,19,
OBI-WAN,COUNT DOOKU,547,"Well, I hope it doesn't take too long. I have work to do.",2,13,
COUNT DOOKU,OBI-WAN,548,May I ask why a Jedi knight... is all the way out here on Geonosis?,3,15,
OBI-WAN,COUNT DOOKU,549,I've been tracking a bounty hunter named Jango Fett. Do you know him?,3,13,
COUNT DOOKU,OBI-WAN,550,There are no bounty hunters here that I am aware of. The Geonosians don't trust them.,4,16,
OBI-WAN,COUNT DOOKU,551,"Who can blame them? But he is here, I can assure you.",2,12,
COUNT DOOKU,OBI-WAN,552,"It's a great pity that our paths have never crossed before, Obi-Wan. Qui-Gon always spoke very highly of you. I wish he were still alive. I could use his help right now.",6,32,
OBI-WAN,COUNT DOOKU,553,Qui-Gon Jinn would never join you.,2,6,
COUNT DOOKU,OBI-WAN,554,"Don't be so sure, my young Jedi. You forget that he was once my apprentice... just as you were once his. He knew all about the corruption in the senate... but he would never have gone along with it if he had learned the truth as I have.",11,48,
OBI-WAN,COUNT DOOKU,555,The truth?,1,2,
COUNT DOOKU,OBI-WAN,556,The truth. What if I told you that the Republic... was now under the control of the dark lord of the Sith?,5,22,
OBI-WAN,COUNT DOOKU,557,"No, that's not possible. The Jedi would be aware of it.",2,11,
COUNT DOOKU,OBI-WAN,558,"The dark side of the Force has clouded their vision, my friend. Hundreds of senators are now under the influence... of a Sith lord called Darth Sidious.",6,27,
OBI-WAN,COUNT DOOKU,559,I don't believe you.,1,4,
COUNT DOOKU,OBI-WAN,560,"The viceroy of the Trade Federation... was once in league with this Darth Sidious... but he was betrayed ten years ago by the dark lord. He came to me for help. He told me everything. You must join me, Obi-Wan... and together we will destroy the Sith!",11,47,
OBI-WAN,COUNT DOOKU,561,"I will never join you, Dooku.",1,6,
COUNT DOOKU,OBI-WAN,562,It may be difficult to secure your release.,2,8,
JAR JAR,GROUP,563,"It's-a clear desa separatists made a pact... wesa desa Federation du Trade. Senators, ''dellow felagates'' In response to this direct threat to the Republic... mesa propose that the senate... give immediately emergency powers... to the supreme chancellor.",12,37,
AUDIENCE,JAR JAR,564,Palpatine! Palpatine! Palpatine!,1,3,
MAS AMEDDA,GROUP,565,Order! We shall have order!,1,5,
PALPATINE,GROUP,566,It is with great reluctance... that I have agreed to this calling. I love democracy. I love the Republic. The power you give me... I will lay down when this crisis has abated. And as my first act with this new authority... I will create a grand army of the Republic... to counter the increasing threats of the separatists.,14,59,
